{
  "$schema": "https://json-schema.org/draft/2020-12/schema",
  "$id": "https://formal-ci-cd.github.io/trust-boundary-verification/common-model.schema.json",
  "title": "CI/CD trust boundary common model",
  "type": "object",
  "required": [
    "schemaVersion",
    "source",
    "workflow",
    "sharedStateOperations",
    "verificationFacts",
    "runtimeObservations"
  ],
  "properties": {
    "schemaVersion": {
      "const": "0.1.0"
    },
    "source": {
      "type": "object",
      "required": ["type", "file", "staticAnalysisOnly"],
      "properties": {
        "type": {"enum": ["codeqlTable", "yamlLibrary"]},
        "file": {"type": "string"},
        "staticAnalysisOnly": {"const": true}
      },
      "additionalProperties": false
    },
    "workflow": {
      "type": "object",
      "required": ["name", "file", "events", "permissions", "jobs", "expressions"],
      "properties": {
        "name": {"type": "string"},
        "file": {"type": "string"},
        "events": {
          "type": "array",
          "items": {"$ref": "#/$defs/event"}
        },
        "permissions": {
          "type": "array",
          "items": {"$ref": "#/$defs/permission"}
        },
        "jobs": {
          "type": "array",
          "items": {"$ref": "#/$defs/job"}
        },
        "expressions": {
          "type": "array",
          "items": {"$ref": "#/$defs/expression"}
        },
        "permissionsDeclared": {"type": "boolean"},
        "env": {"type": "object", "additionalProperties": {"type": "string"}}
      },
      "additionalProperties": false
    },
    "sharedStateOperations": {
      "type": "array",
      "items": {"$ref": "#/$defs/sharedStateOperation"}
    },
    "verificationFacts": {
      "$ref": "#/$defs/verificationFacts"
    },
    "runtimeObservations": {
      "type": "array",
      "items": {"$ref": "#/$defs/runtimeObservation"}
    }
  },
  "$defs": {
    "event": {
      "type": "object",
      "required": ["name", "externallyTriggerable", "privileged"],
      "properties": {
        "name": {"type": "string"},
        "externallyTriggerable": {"type": "boolean"},
        "privileged": {"type": "boolean"},
        "properties": {
          "type": "object",
          "additionalProperties": {
            "type": "array",
            "items": {"type": "string"}
          }
        }
      },
      "additionalProperties": false
    },
    "permission": {
      "type": "object",
      "required": ["jobId", "scope", "access"],
      "properties": {
        "jobId": {"type": ["string", "null"]},
        "scope": {"type": "string"},
        "access": {"type": "string"}
      },
      "additionalProperties": false
    },
    "job": {
      "type": "object",
      "required": ["id", "runnerLabels", "steps"],
      "properties": {
        "id": {"type": "string"},
        "runnerLabels": {
          "type": "array",
          "items": {"type": "string"}
        },
        "steps": {
          "type": "array",
          "items": {"$ref": "#/$defs/step"}
        },
        "condition": {"type": "string"},
        "env": {"type": "object", "additionalProperties": {"type": "string"}},
        "needs": {"type": ["array", "string"]},
        "permissionsDeclared": {"type": "boolean"},
        "uses": {"type": "string"},
        "arguments": {"type": "object", "additionalProperties": {"type": "string"}},
        "environment": {"type": ["string", "object", "null"]}
      },
      "additionalProperties": false
    },
    "step": {
      "type": "object",
      "required": ["index", "type"],
      "properties": {
        "index": {"type": "integer", "minimum": 0},
        "type": {"enum": ["uses", "run"]},
        "action": {"type": "string"},
        "version": {"type": "string"},
        "arguments": {"type": "object", "additionalProperties": {"type": "string"}},
        "command": {"type": "string"},
        "commands": {
          "type": "array",
          "items": {
            "type": "object",
            "required": ["text", "line"],
            "properties": {
              "text": {"type": "string"},
              "line": {"type": "integer", "minimum": 1}
            },
            "additionalProperties": false
          }
        },
        "commandOrderKnown": {"type": "boolean"},
        "id": {"type": "string"},
        "condition": {"type": "string"},
        "env": {"type": "object", "additionalProperties": {"type": "string"}},
        "line": {"type": "integer", "minimum": 1},
        "shell": {"type": "string"},
        "workingDirectory": {"type": "string"}
      },
      "additionalProperties": false
    },
    "expression": {
      "type": "object",
      "required": ["raw", "normalized", "line"],
      "properties": {
        "raw": {"type": "string"},
        "normalized": {"type": "string"},
        "line": {"type": "integer", "minimum": 1}
      },
      "additionalProperties": false
    },
    "sharedStateOperation": {
      "type": "object",
      "required": ["id", "kind", "jobId", "stepIndex", "key", "path"],
      "properties": {
        "id": {"type": "string"},
        "kind": {
          "enum": [
            "cacheWriteIntent",
            "cacheReadIntent",
            "artifactWriteIntent",
            "artifactReadIntent"
          ]
        },
        "jobId": {"type": "string"},
        "stepIndex": {"type": "integer", "minimum": 0},
        "key": {"type": ["string", "null"]},
        "path": {"type": ["string", "null"]},
        "name": {"type": ["string", "null"]},
        "runId": {"type": ["string", "null"]}
      },
      "additionalProperties": false
    },
    "verificationFacts": {
      "type": "object",
      "required": [
        "sameObject",
        "consumerUsesObject",
        "integrityVerified",
        "privilegedConsumer",
        "hasAuthority"
      ],
      "properties": {
        "sameObject": {"enum": ["true", "false", "unknown"]},
        "consumerUsesObject": {"enum": ["true", "false", "unknown"]},
        "integrityVerified": {"enum": ["true", "false", "unknown"]},
        "privilegedConsumer": {"enum": ["true", "false", "unknown"]},
        "hasAuthority": {"enum": ["true", "false", "unknown"]}
      },
      "additionalProperties": false
    },
    "runtimeObservation": {
      "type": "object",
      "required": [
        "id",
        "platform",
        "runId",
        "observedAt",
        "platformPolicy",
        "operationResults"
      ],
      "properties": {
        "id": {"type": "string"},
        "platform": {"type": "string"},
        "runId": {"type": "string"},
        "observedAt": {"type": "string", "format": "date"},
        "platformPolicy": {
          "type": "object",
          "required": ["cacheWriteDecision", "effectiveFrom", "basis"],
          "properties": {
            "cacheWriteDecision": {"enum": ["allowed", "denied", "unknown"]},
            "effectiveFrom": {"type": "string", "format": "date"},
            "basis": {"type": "string", "format": "uri"}
          },
          "additionalProperties": false
        },
        "operationResults": {
          "type": "array",
          "items": {
            "type": "object",
            "required": ["operationId", "outcome", "evidence"],
            "properties": {
              "operationId": {"type": "string"},
              "outcome": {"enum": ["succeeded", "failed", "unknown"]},
              "evidence": {"type": "array", "items": {"type": "string"}}
            },
            "additionalProperties": false
          }
        }
      },
      "additionalProperties": false
    }
  },
  "additionalProperties": false
}
